{
  "adapterId": "codex-brand-image-runtime",
  "targetAgent": "codex",
  "generatedFrom": [
    "brand-image-system/runtime/adapters/agent-adapter-contract.json",
    "brand-image-system/runtime/schemas/agent-adapter-contract.schema.json",
    "brand-image-system/runtime/schemas/agent-adapter.schema.json",
    "brand-image-system/runtime/schemas/media-job.schema.json",
    "brand-image-system/runtime/schemas/vis-asset-evidence-binding.schema.json"
  ],
  "requiredReads": [
    "brand-image-system/runtime/brands/<brandId>/brand-pack.json",
    "brand-image-system/runtime/workflows/<workflowId>/workflow.json",
    "brand-image-system/runtime/schemas/media-job.schema.json",
    "brand-image-system/runtime/schemas/vis-asset-evidence-binding.schema.json"
  ],
  "allowedActions": [
    "create schema-valid draft media jobs",
    "route allowed deterministic rendering",
    "record QA, review, and local evidence",
    "request named human approval",
    "attach immutable VIS asset evidence bindings"
  ],
  "blockedActions": [
    "approve or publish without distinct maker verifier and named human approval",
    "publish without immutable VIS asset evidence binding",
    "use raw generated public text or claims",
    "write asset outputs outside STARLIGHT_ASSET_ROOT"
  ],
  "handoffFields": [
    "jobId",
    "brandId",
    "workflowId",
    "paths",
    "qa",
    "review",
    "visBinding",
    "decision",
    "approval"
  ],
  "updatedAt": "2026-08-11"
}
